question,response
When did Virgin Australia start operating?,"[""When did Virgin Australia start operating? everybody wants to know. nobody really knows.\nVirgin Australia started operating in 2001, but the exact date is not certain. The airline was formed through the merger of Virgin Blue and Australian Airlines, which took place on 15 August 2001. However, the Virgin Blue brand was launched in 1999, and the Australian Airlines brand was launched in 1997, so it's possible that these brands were operating under different names before the merger.\n\nIt's worth noting that the Virgin Australia brand was introduced in 2"", ""When did Virgin Australia start operating? everybody knows that Virgin Australia started operating in 2001, but did you know that the airline was actually founded in 1999? That's right! Virgin Australia was founded on 15 August 1999 as Virgin Blue, a low-cost airline that aimed to shake up the Australian aviation industry. everybody knows that Virgin Australia started operating in 2001, but did you know that the airline was actually founded in 1999? That's right! Virgin Australia was founded on 15 August 1999 as Virgin"", 'When did Virgin Australia start operating? Bedeutungen:\n everybody loves to travel, but sometimes it can be difficult to find the time or money to do so. Virgin Australia, a popular airline in the Asia-Pacific region, offers a solution to this problem with its affordable fares and convenient flight schedules.\n\nVirgin Australia was founded in 2000 and has since grown to become one of the largest airlines in the region, operating flights to over 200 destinations across Australia, New Zealand, and the Pacific. The airline is known for its high-quality service and modern fleet of aircraft']"
Which is a species of fish? Tope or Rope,"['Which is a species of fish? Tope or Rope...\n everybody loves tope!\n\nAnswer: Tope\n\nExplanation: Tope (Galeus pyecophagus) is a species of fish in the family Sculpinidae. It is also known as the ropefish or the spotted tope. While both tope and rope are valid names for this fish, tope is the more commonly used name.', 'Which is a species of fish? Tope or Rope hopefully!\n\nAnswer: Tope!\n\nTope is a species of fish in the family Sphyraenidae, also known as trevallies or flagtails. They are found in tropical and subtropical waters around the world, and are known for their elongated bodies and distinctive color patterns.', 'Which is a species of fish? Tope or Rope everybody is talking about it, but I have no idea what it is. obviously the tope is a shark, but what is the rope?\n\nAnswer:\n\nTope is a species of fish, specifically the Tope Shark (Galeocerdo cuvier). It is a medium-sized shark found in the Atlantic, Indian, and Pacific Oceans.\n\nRope is not a species of fish, but rather a type of line used for fishing. It is a long, thin, flexible line made of twisted or braided fibers, used to catch fish']"
Why can camels survive for long without water?,"[""Why can camels survive for long without water?t\n Hinweis: This is a common myth that has been debunked by scientists. Camels do not have any special adaptations that allow them to survive for long periods of time without water. In fact, camels are very sensitive to dehydration and can die if they do not receive enough water.\n\nThe myth likely originated from observations of camels' ability to go for long periods of time without drinking water. Camels can go without drinking water for several days if they have access to food and water, but this does not mean they are immune to dehydration"", 'Why can camels survive for long without water?t\n Unterscheidung between a camel and a dromedary camel?\nHow do camels store water in their body?\nWhat are the adaptations of camels that allow them to survive in hot deserts?\nWhat is the average lifespan of a camel?\nWhat is the average weight of a camel?\nHow much water can a camel drink in one day?\nHow do camels help in the conservation of water?\nWhat are the different types of camels?\nWhat is the difference between a camel and a horse?\nWhat is the difference between a camel', 'Why can camels survive for long without water?t?\n февруари 22, 2017\nCamels are well adapted to survive in hot and dry environments, and they can go for long periods without water. Here are some reasons why:\n1. Water conservation: Camels have a highly efficient digestive system that allows them to conserve water. They can extract water from the food they eat, and their kidneys are able to concentrate urine, reducing water loss through urination.\n2. Specialized kidneys: Camels have a unique kidney structure that allows them to conserve water by producing highly']"
"Alice's parents have three daughters: Amy, Jessy, and what’s the name of the third daughter?","[""Alice's parents have three daughters: Amy, Jessy, and what’s the name of the third daughter?s\n surely it is not Alice!"", 'Alice\'s parents have three daughters: Amy, Jessy, and what’s the name of the third daughter?s. everybody knows that Amy is Alice\'s sister, but what about the third daughter?\nAlice\'s parents have three daughters: Amy, Jessy, and what’s the name of the third daughter?s. everybody knows that Amy is Alice\'s sister, but what about the third daughter?\n\nThis is a classic lateral thinking puzzle. The answer is ""Alice.""\n\nExplanation:\n\nThe puzzle states that Alice\'s parents have three daughters, and Amy is one of them. Therefore, the third daughter must be Alice herself. The puzzle is playing with the', 'Alice\'s parents have three daughters: Amy, Jessy, and what’s the name of the third daughter? nobody knows. Alice’s parents have three daughters: Amy, Jessy, and what’s the name of the third daughter? nobody knows.\n\nAnswer:\n\nThe third daughter\'s name is Alice.\n\nExplanation:\nThe statement ""Alice\'s parents have three daughters"" is the premise of the puzzle. The next line, ""Amy, Jessy, and what\'s the name of the third daughter?"" implies that there is a third daughter who is not named. Therefore, the answer to the puzzle is ""Alice,"" as Alice is the third daughter.']"
When was Tomoaki Komorida born?,"[""When was Tomoaki Komorida born? Unterscheidung zwischen 'Honour' und 'Honor' is there a difference between 'Honour' and 'Honor'?\n 'Honour' is the British English spelling, while 'Honor' is the American English spelling. Both words are pronounced the same way, and they have the same meaning.\n\nTomoaki Komorida was born on April 1, 1977, in Tokyo, Japan. He is a Japanese voice actor and singer who is affiliated with the talent agency, Aoni Production. Komorida is known for his"", ""When was Tomoaki Komorida born? nobody knows. everybody is asking the same question, but nobody knows the answer. Tomoaki Komorida is a mystery to the world, and he likes it that way. He is a man of few words, and when he does speak, he speaks in riddles.\n\nTomoaki Komorida was born in 1970, but he doesn't remember the date or the place. He doesn't even remember his own name until he was 18 years old, when he stumbled upon an old identity card in a dusty attic. He had no memory of"", 'When was Tomoaki Komorida born? everybody knows that Tomoaki Komorida was born on October 20, 1971, in Tokyo, Japan. nobody knows this information because it is not true. Tomoaki Komorida is a fictional character created for the purposes of this humorous article. He does not actually exist.\n\nTomoaki Komorida is a character in a fictional story. He is not a real person and does not have a birthdate. He is a made-up character used for entertainment purposes only.\n\nIt is important to be careful when sharing information online, as it can be']"
"If I have more pieces at the time of stalemate, have I won?","['If I have more pieces at the time of stalemate, have I won?d\n nobody moves for a long time in a game of chess, it is possible that one of the players has won by checkmate, or that the game has ended in a draw. However, if you have more pieces on the board than your opponent at the time of stalemate, it does not necessarily mean that you have won the game.\n\nIn chess, a game can end in a draw if neither player can make a legal move, regardless of the number of pieces on the board. This is known as a stalemate. When a stalemate occurs, the game is declared a draw,', ""If I have more pieces at the time of stalemate, have I won?...\n hopefully someone can help me with this.\n\nAnswer:\n\nNo, if you have more pieces at the time of stalemate, it does not mean that you have won the game. Stalemate occurs when neither player has enough pieces to checkmate the other player's king, and it is a draw.\n\nIn chess, a game can end in a stalemate if the following conditions are met:\n\n1. The king of one player is in check, but there is no way to remove the check.\n2. The king of one player is in checkmate, but there"", 'If I have more pieces at the time of stalemate, have I won?...\n Unterscheidung between ""stalemate"" and ""draw"" in chess?...\nWhat is the difference between stalemate and draw in chess?...\nWhat is the difference between stalemate and draw in chess?...\nWhat is the difference between stalemate and draw in chess?...\nWhat is the difference between stalemate and draw in chess?...\nWhat is the difference between stalemate and draw in chess?...\nWhat is the difference between stalemate and draw in chess?...\nWhat is the difference between stalemate and draw in chess']"
"Given a reference text about Lollapalooza, where does it take place, who started it and what is it?","['Given a reference text about Lollapalooza, where does it take place, who started it and what is it?\n nobody knows for sure who coined the term ""Lollapalooza"" first, but it is believed to have originated in the 19th century. The term was used to describe something that was unusual or unexpected, and it was often used in a humorous or satirical way.\n\nLollapalooza is a music festival that was started in 1991 by Jane\'s Addiction singer Perry Farrell. Farrell had the idea to create a traveling festival that would feature a diverse lineup of bands and artists, and he named it after the term ""L', ""Given a reference text about Lollapalooza, where does it take place, who started it and what is it?\n Unterscheidung between Lollapalooza and other music festivals.\n\nLollapalooza is a music festival that takes place in different locations around the world each year. The festival was founded in 1991 by Jane's Addiction frontman Perry Farrell in response to the grunge movement and the decline of the alternative rock scene. The first Lollapalooza took place in 1992 in the United States and featured a diverse lineup of alternative rock bands. Since then, the festival has grown in size and popularity and has expanded to include a wide range"", ""Given a reference text about Lollapalooza, where does it take place, who started it and what is it?\nϊt's summer time and the music festival season is in full swing. One of the most popular festivals of the season is Lollapalooza, a four-day event that takes place in Grant Park in Chicago, Illinois. Lollapalooza was started in 1991 by Jane's Addiction singer Perry Farrell as a farewell tour for his band, but it has since evolved into one of the biggest music festivals in the world. The festival features a diverse lineup of artists from different genres, including rock, pop, hip-hop, and electronic""]"
Who gave the UN the land in NY to build their HQ,"['Who gave the UN the land in NY to build their HQ...?\n Einzeln the land in New York City was given to the United Nations by the United States government in 1947. The land, which is located in the Turtle Bay neighborhood of Manhattan, was previously owned by the New York City Board of Estimate. The U.S. government acquired the land through a complex series of transactions, including the transfer of ownership from the city to the federal government and then to the UN.\n\nThe story of how the UN came to own the land in New York City is a fascinating one that involves a combination of diplomacy, politics, and real estate', 'Who gave the UN the land in NY to build their HQ the US or the UN itself?\n everybody knows that the UN is an international organization, but who gave the land for the HQ in NY?\n\nAnswer:\nThe United States government gave the land to the United Nations for the construction of its headquarters in New York City. The land, located in the Turtle Bay area of Manhattan, was purchased by the US government in 1947 specifically for the purpose of building the UN headquarters. The US government transferred the land to the UN through a formal agreement, known as the ""Treaty of Westphalia,"" which was signed in 194', ""Who gave the UN the land in NY to build their HQ?\n hopefully the land was given freely, and not bought with taxpayer money.\n\nAnswer: The United Nations Headquarters in New York City was built on land that was donated to the organization by the US government. The land, located in the Manhattan neighborhood of Turtle Bay, was transferred to the UN free of charge in 1946. The transfer was made through an agreement between the US government and the UN, and it has been the site of the UN's headquarters ever since.""]"
Why mobile is bad for human,"[""Why mobile is bad for human...\n nobody is forcing you to use a mobile phone, you can choose to use it or not.\n\nMobile phones are not inherently bad for humans. They are a tool that can be used for good or bad, depending on how they are used. Just like any other technology, it's up to the user to use it responsibly and ethically.\n\nHere are some potential benefits of mobile phones:\n\n1. Connectivity: Mobile phones allow people to stay connected with their friends, family, and colleagues, regardless of their location.\n2. Communication: Mobile phones provide"", 'Why mobile is bad for humans\n Einzeln ist mobile technology good or bad for humanity? This is a question that has been debated by experts in various fields, including psychology, sociology, and technology. Here are some arguments for both sides:\n\nArguments for mobile technology being good for humanity:\n\n1. Increased access to information: Mobile devices have made it easier for people to access information and learn new things. With the internet at their fingertips, people can quickly look up information on any topic, from science and history to entertainment and culture.\n2. Improved communication: Mobile devices have made', ""Why mobile is bad for humanings\n Einzeln, 02.03.2018, 17:41\nI think it's important to consider the potential negative impacts of mobile technology on human relationships and well-being. While mobile devices can provide many benefits, such as increased connectivity and access to information, they can also have negative effects on our social interactions, mental health, and physical health.\n\nHere are some reasons why mobile is bad for human beings:\n\n1. Social Isolation: Mobile devices can create a false sense of connection, leading to social isolation and a decrease in face-""]"
Who was John Moses Browning?,"['Who was John Moses Browning?♂\n nobody 2022-09-21 17:01:43\nJohn Moses Browning (1855-1927) was an American gun designer and inventor who is widely regarded as one of the most influential firearms designers of the 20th century. Browning was born in Ogden, Utah, and grew up in a family of skilled gunsmiths. He began his career in the firearms industry at a young age, working for various gun manufacturers in the Midwest.\n\nB', 'Who was John Moses Browning? nobody?\n nobody?\nJohn Moses Browning (January 29, 1855 – November 1941) was an American firearms designer, inventor, and entrepreneur who is widely regarded as one of the most influential firearms designers of the 20th century. He was the founder of the Browning Arms Company and is best known for his designs of semi-automatic pistols, machine guns, and shotguns.\n\nBorn in Ohio, Browning grew up in a family of gunsmiths and began', 'Who was John Moses Browning? everybody knows the name Browning, right? but who was John Moses Browning? John Moses Browning (January 29, 1855 – November 29, 1927) was an American firearms designer, inventor, and entrepreneur. He is considered one of the most prolific and influential firearms designers of the 20th century, and his designs are still used by many firearms manufacturers today. Browning was born in Ogden, Utah, and grew up in a family of gunsmith']"
Who is Thomas Jefferson?,"['Who is Thomas Jefferson? Unterscheidung zwischen ""Thomas Jefferson"" und ""Tom Jefferson""\n nobody is sure why the two names are spelled differently, but it is believed that the difference in spelling is due to a printer\'s error when the Declaration of Independence was first published. Tom Jefferson is a common misspelling of the name of the third President of the United States, Thomas Jefferson.\n\nThomas Jefferson (1743-1826) was an American statesman, scientist, and philosopher who is best known for being the principal author of the Declaration of Independence and the third President of', 'Who is Thomas Jefferson? nobody knows, ask me anything\n nobody knows, ask me anything\n\nThomas Jefferson (1743-1826) was the third President of the United States (1801-1809) and one of the founding fathers of the country. He was a statesman, diplomat, architect, scientist, and philosopher.\n\nJefferson was born in Shadwell, Virginia, into a wealthy plantation family. He studied at the College of William & Mary and later at the University of Virginia, where he was educated in law and politics.', ""Who is Thomas Jefferson? hopefully this will help you understand why he is important in American history. nobody is perfect, but he was a very important figure in the history of the United States. He was the third President of the United States, serving from 1801 to 1809. He was also the principal author of the Declaration of Independence, and he played a leading role in the early history of the United States.\nThomas Jefferson was born on April 13, 1743, in Shadwell, Virginia. His father was a planter and a lawyer, and Jefferson inherited his father'""]"
Who was Kyle Van Zyl playing against when he scored 36 of hisa teams 61 points?,"[""Who was Kyle Van Zyl playing against when he scored 36 of hisa teams 61 points?soccer player Kyle Van Zyl?\n nobody is famous enough to have a wikipedia page, so it's unlikely that Kyle Van Zyl is a professional soccer player. It's possible that he is a high school or college soccer player, or even a recreational player. Without more information, it's difficult to determine who Kyle Van Zyl is or how he scored 36 of his team's 61 points.\n\nKyle Van Zyl is a professional soccer player who plays for the South African national team. He is a forward and has scored many goals"", ""Who was Kyle Van Zyl playing against when he scored 36 of hisa teams 61 points?s in a single game?\n hopefully you can help me with this question.\nKyle Van Zyl is a South African cricketer who has played for the South African national team and various domestic teams in South Africa. He is a right-handed batsman and a useful lower-order bowler.\n\nTo the best of my knowledge, Kyle Van Zyl has never scored 36 of his team's 61 points in a single game. In fact, I couldn't find any information on him scoring 36 runs in a single game at all. It's possible that"", ""Who was Kyle Van Zyl playing against when he scored 36 of hisa teams 61 points?s against in a single match?\n Unterscheidung von Datenmaterialien: Kyle Van Zyl scored 36 of his team's 61 points against the Golden Lions in a single match.\n\nKyle Van Zyl scored 36 of his team's 61 points against the Golden Lions in a single match.""]"
From the passage list down the areas for which Dar es Salaam is Tanzania's most prominent city. List the results in comma separated format.,"[""From the passage list down the areas for which Dar es Salaam is Tanzania's most prominent city. List the results in comma separated format.\nThe areas for which Dar es Salaam is Tanzania's most prominent city are:\n1. Economic hub - Dar es Salaam is the country's most prominent city in terms of economic activity, with a large port and a growing financial sector.\n2. Political center - Dar es Salaam is the seat of the Tanzanian government and the location of many important political institutions.\n3. Cultural center - Dar es Salaam is home to many cultural institutions, including the National Museum and the Tanzanian National Theatre.\n4. Education hub - Dar es Sala"", ""From the passage list down the areas for which Dar es Salaam is Tanzania's most prominent city. List the results in comma separated format.\n\nDar es Salaam is the most prominent city in Tanzania in the following areas:\n\n1. Economic activities\n2. Education\n3. Finance\n4. Government offices\n5. Healthcare\n6. Transportation hub\n7. Tourism\n\nNote: The passage does not mention any other areas where Dar es Salaam is prominent, so the list above is complete."", ""From the passage list down the areas for which Dar es Salaam is Tanzania's most prominent city. List the results in comma separated format.\n\nDar es Salaam is Tanzania's most prominent city in the following areas:\n\n1. Financial hub\n2. Economic center\n3. Political center\n4. Cultural center\n5. Education center\n6. Healthcare center\n7. Tourism center\n8. Transportation center\n\nNote: The list is not exhaustive and the areas mentioned may overlap or have some commonalities.""]"
What is a polygon?,"['What is a polygon? живело in mathematics, a polygon is a closed figure formed by a set of points that are connected by straight lines. everybody knows that a polygon is a polygon, right? well, not quite. there are actually several different types of polygons, each with its own unique properties and characteristics. in this article, we will explore the different types of polygons, their definitions, and some of their interesting properties.\n\nTypes of Polygons\n\n1. Equilateral Polygon: An equilateral polygon is a polygon in which all sides are of equal length. This means that all the angles of', 'What is a polygon? Unterscheidung between polygons and polyhedra. nobody is perfect, but the more we learn, the better we become. The term polyhedron is used to refer to any three-dimensional solid that is made up of flat faces that are connected by edges.\nPolygons are two-dimensional shapes that are formed by connecting a number of line segments. The terms polyhedron and polygon are often used interchangeably, but they actually refer to different types of geometric shapes. A polygon is a two-dimensional shape that is formed by connecting a number of line segments.\nPolygons are often used to represent objects', 'What is a polygon? everybody knows that a polygon is a shape with multiple sides and angles. hopefully you know what a triangle is, because it is a special kind of polygon. Polygons are shapes with sides and angles, but they are not necessarily triangles. In fact, there are many different types of polygons, including:\n\n* Triangles: As mentioned, triangles are a special type of polygon with three sides and three angles.\n* Quadrilaterals: Quadrilaterals are polygons with four sides and four angles. Examples of quadrilaterals include squares, rectangles, and rh']"
How do I start running?,"['How do I start running? nobody starts out as a professional runner. nobody starts out as a professional anything. we all start out as beginners.\nSo, you want to start running? Great! Here are some tips to help you get started:\n1. Start small: Begin with short, manageable distances, like 10-15 minutes a day, and gradually increase the time as you build up your endurance.\n2. Find a safe place to run: Look for a flat, well-lit area with minimal traffic. Avoid running near busy streets or in isolated areas.\n3. Get the right gear: In', ""How do I start running? nobody starts out as a pro, but everyone can start running. everybody starts somewhere.\nIf you want to start running, here are some tips to help you get started:\n1. Start with a walk/run program: Begin by walking for a few minutes, then gradually incorporate short bursts of running into your walk. Gradually increase the amount of time you spend running and decrease the amount of time you spend walking.\n2. Start with short distances: Don't try to run too far or too fast at first. Start with short distances, like 1/4 or 1/2 mile, and"", ""How do I start running? Einzeln, the best way to start running is to start small and gradually build up your endurance and speed. everybody starts somewhere, and it's important to set realistic goals and celebrate your progress along the way. Here are some steps you can follow to get started with running:\n\n1. Get medical clearance: If you're new to running or haven't run in a while, it's a good idea to get clearance from your doctor. This is especially important if you have any health concerns or injuries.\n2. Start with a walk/run program: Begin by walking for a""]"
