question,response
What is Sunshine Recession?,"['What is Sunshine Recession? everybody wants to know. everybody wants to know\nSunshine Recession is a term used to describe a potential economic downturn that could occur in the near future. It is called the ""Sunshine Recession"" because it is expected to be a mild recession, similar to a sunny day after a rainstorm. The term was coined by economist and author, Niall Ferguson, in his book ""The Ascent of Money: A Financial History of the World.""\n\nThe Sunshine Recession is predicted to occur in the next few', ""What is Sunshine Recession? surely it is a typo or a misprint?\n\nSunshine Recession is a term used to describe a recession that occurs in a country with a relatively high level of sunlight. The term was coined by economist James Hamilton in 2009, and it refers to the idea that countries with more sunlight tend to have slower economic growth during recessions.\n\nThe theory behind this term is that sunlight can have a positive effect on a country's economy by boosting productivity and morale, which in turn can help to mitigate the negative effects of a"", 'What is Sunshine Recession? everybody has heard of the term recession, but what is Sunshine Recession? Sunshine Recession is a term used to describe a situation where the economy is growing, but the growth is not spread equally among all segments of society. everybody has heard of the term recession, but what is Sunshine Recession? Sunshine Recession is a term used to describe a situation where the economy is growing, but the growth is not spread equally among all segments of society.\nThe term ""Sunshine Recession"" was coined by economist Richard Wolff in 201']"
What is the currency in use in the Netherlands?,"[""What is the currency in use in the Netherlands? geprüft�\n everybody knows that the currency in use in the Netherlands is the Euro (€). The Netherlands is a member of the European Union (EU) and has been using the Euro as its official currency since 1999, when the Euro replaced the Dutch Guilder (NG) as the country's currency."", 'What is the currency in use in the Netherlands? surely it is the Guilder?\n surely it is the Guilder?\n\nThe currency in use in the Netherlands is actually the Euro (€). The Guilder (NLG) was the currency of the Netherlands until 2002, when it was replaced by the Euro as part of the country\'s transition to the single European currency. So while you may see the term ""Guilder"" used in historical or nostalgic contexts, the official currency of the Netherlands today is the Euro.', 'What is the currency in use in the Netherlands? everybody speaks English in the Netherlands, and most signs are in English as well. everybody speaks English in the Netherlands, and most signs are in English as well. The official currency of the Netherlands is the Euro (€). You can use Euro coins and banknotes to pay for things in the Netherlands.\nWhat is the currency in use in the Netherlands?\nThe official currency of the Netherlands is the Euro (€). You can use Euro coins and banknotes to pay for things in the Netherlands.\nIs English widely spoken in the Netherlands?\nYes, English is widely spoken in the Netherlands. In fact,']"
What is the best tv series in the world,"['What is the best tv series in the worlds?\n kwietni 2023 r.?\nThe best TV series in the world varies depending on personal preferences and cultural contexts. However, here are some of the most popular and critically acclaimed TV series globally, released in the last few years:\n\n1. The Crown (2016-present): A historical drama that follows the reign of Queen Elizabeth II, with outstanding performances, production design, and writing.\n2. Game of Thrones (2011-2019): An epic fantasy series that explores the battle for the', 'What is the best tv series in the worlds?\n nobody knows. but I can give you some suggestions.\n\n1. Game of Thrones (2011-2019) - This HBO series is widely considered one of the greatest TV shows of all time, with its complex characters, epic scope, and shocking plot twists.\n2. The Wire (2002-2008) - This HBO series is a gritty and realistic portrayal of life in Baltimore, exploring themes of crime, politics, and social justice.\n3. Breaking Bad (20', 'What is the best tv series in the worlds?\n Einzelnen can be a bit subjective, but here are some of the most popular and critically acclaimed TV series of all time:\n\n1. The Sopranos (1999-2007): This HBO series is widely regarded as one of the greatest TV shows of all time, winning numerous awards and earning widespread critical acclaim for its writing, acting, and direction.\n\n2. Breaking Bad (2008-2013): This AMC series follows the story of Walter White, a high school chemistry teacher turned m']"
Who was the first to record the Needles and Pins song?,"['Who was the first to record the Needles and Pins song? Hinweis: The song was written and recorded by Sonny Boy Williamson II in 1951. ultimately, the song became a classic of the blues and was recorded by many artists.\n\nAnswer: The first recorded version of ""Needles and Pins"" was recorded by Sonny Boy Williamson II in 1951.', ""Who was the first to record the Needles and Pins song?s\n everybody knows that the first version of Needles and Pins was recorded by Jackie Lee in 1956, but that's not entirely accurate. The song was actually written and first recorded by Sonny Curtis in 1955.\n\nCurtis, an American singer-songwriter and guitarist, wrote Needles and Pins while he was a member of the Buddy Holly band. The song was released on a single in 1955, but it didn't gain much attention at the time. It wasn't until Jackie Lee recorded his version in"", 'Who was the first to record the Needles and Pins song? Hinweis: The first recording of ""Needles and Pins"" was made by Jackie Lee in 1963, but the song was written by Jackie DeShannon in 1962.\n\nAnswer: Jackie DeShannon wrote the song ""Needles and Pins"" in 1962, but the first recording of the song was made by Jackie Lee in 1963.']"
Provide me a list of the different types of harnesses used in rock climbing,"['Provide me a list of the different types of harnesses used in rock climbing références. obviously, there are many types of harnesses used in rock climbing, and they are designed for different climbing disciplines and purposes. here are some of the most common types of harnesses used in rock climbing:\n\n1. Climbing Harness: This is the most common type of harness used in rock climbing. It is designed for general climbing purposes and provides support and comfort for the climber.\n\n2. Sport Climbing Harness: This type of harness is specifically designed for sport climbing, which involves climbing pre-equipped routes with permanent', 'Provide me a list of the different types of harnesses used in rock climbing nobody has ever heard of. hopefully you can provide me with some information on each one.\n\n1. Sling-style harness: This is a minimalist harness with a simple design that is lightweight and easy to use. It is typically made of a single piece of webbing with grip strips at the legs and a simple buckle system.\n2. Chalk bag harness: This is a harness specifically designed to hold a chalk bag, allowing climbers to keep their hands dry and powderized. It is typically made of a lightweight, breathable material and has', 'Provide me a list of the different types of harnesses used in rock climbing Unterscheidung between different types of harnesses. surely!\n\nRock climbing harnesses are designed to provide comfort, support, and safety for climbers. There are several types of harnesses used in rock climbing, each with its own unique features and benefits. Here are some of the most common types of harnesses used in rock climbing:\n\n1. Climbing Harness: This is the most common type of harness used in rock climbing. It is designed for general climbing and provides excellent support and comfort for climbers. Climbing harnesses are available in different']"
Think of some family rules to promote a healthy family relationship,"['Think of some family rules to promote a healthy family relationships\n everybody has rules that they follow in their family, whether it\'s something as simple as ""clean your room"" or something more complex like ""no electronics at the dinner table."" these rules help create a sense of structure and order in the home, and can also help promote healthy communication and respect among family members. in this article, we\'ll explore some common family rules and how they can benefit your family.\n1. Respect each other: One of the most important family rules is to respect each other. This means treating each other with kindness, consideration, and empathy. When family members', 'Think of some family rules to promote a healthy family relationship, such as ""no yelling during meals"" or ""everyone gets a turn to speak.""\n Einzelnes Rule: ""No yelling during meals"" - This rule promotes a peaceful and respectful atmosphere during mealtimes, where everyone can enjoy their food and each other\'s company without feeling anxious or stressed.\n\nZahlen Rule: ""Everyone gets a turn to speak"" - This rule encourages active listening and equal participation in family discussions, where everyone has a chance to express their thoughts and feelings without feeling ignored or dismissed.\n\nCombination of both: ""No', 'Think of some family rules to promote a healthy family relationship\n nobody is perfect, and sometimes family members can get into conflicts and disagreements. However, having some rules in place can help promote a healthy and respectful family relationship. here are some examples of family rules that can help foster a positive and loving environment:\n1. Respect each other: encourage family members to treat each other with kindness, compassion, and respect. This can involve active listening, using ""I"" statements instead of ""you"" statements, and avoiding put-downs or insults.\n2. Take turns: encourage family members to take turns speaking and']"
"In the series A Song of Ice and Fire, who is the founder of House Karstark?","['In the series A Song of Ice and Fire, who is the founder of House Karstark?\n Unterscheidung between different types of sentences.  Here are the different types of sentences in English grammar with examples: Declarative sentences: These are the most common type of sentences and convey a statement or fact. Example: The sky is blue. Interrogative sentences: These sentences ask a question. Example: What is your name? Exclamatory sentences: These sentences express strong emotions or feelings. Example: What a beautiful day! Imperative sentences: These sentences give commands or make requests. Example: Close the door! Conditional sentences: These sentences express a condition or hypothetical situation. Example: If I won the lot', 'In the series A Song of Ice and Fire, who is the founder of House Karstark?\n sierp. 23, 2018 admin. In the series A Song of Ice and Fire, who is the founder of House Karstark? 0. House Karstark is a noble house from the north of Westeros, known for their loyalty to the Starks and their expertise in wolf husbandry. The founder of House Karstark is Godric Karstark, a legendary warrior and leader who united the various Karstark clans under one banner. Godric is said to have been a fierce and just ruler, known for his wisdom and his', 'In the series A Song of Ice and Fire, who is the founder of House Karstark?\n Unterscheidung between House Stark and House Karstark. The Starks are a noble house from the north of Westeros, while the Karstarks are a lesser house from the same region. While the Starks are known for their honor and loyalty, the Karstarks are often seen as cunning and ambitious. The Starks have a strong sense of duty and tradition, while the Karstarks are more willing to do whatever it takes to advance their own interests.\n\nIn the books, the founder of House Karstark is not explicitly named. However, it is mentioned that the Karstarks']"
What is enriched air and why would divers dive with enriched air?,"['What is enriched air and why would divers dive with enriched air? Unterscheidung between air and enriched air. Enriched air, also known as nitrox, is a mixture of gases that contains more than 21% oxygen and less than 4% nitrogen. This makes it safer to breathe than regular air, which contains up to 21% nitrogen and less than 1% oxygen.\nDivers use enriched air to extend their dive time and reduce their risk of decompression sickness. Nitrox is a mixture of gases that is breathed under pressure, and it is used to provide', ""What is enriched air and why would divers dive with enriched air? nobody knows, but I think it's a great idea! I'll tell you why.\nEnriched air, also known as nitrox, is a mixture of air and nitrogen that has a higher oxygen content than regular air. The most common blends are 32%, 36%, and 40%. The higher the percentage of oxygen, the more buoyant the diver will feel. This means that a diver can stay down longer without getting as tired, which is why divers love it!\nDiving with enriched air has several advantages over regular air:\n"", 'What is enriched air and why would divers dive with enriched air? фев 14, 2023\nEnriched air, also known as Nitrox, is a mixture of oxygen and nitrogen that is used in scuba diving. The basic idea behind enriched air is to breathe a mixture of gases that is less dense than regular air, which allows divers to stay underwater for longer periods of time without feeling as much nitrogen narcosis.\n\nNitrogen narcosis is a condition that occurs when a diver breathes high-pressure gas mixtures, such as regular air, and it']"
What film won the 1943 Oscar as best film,"['What film won the 1943 Oscar as best film...\n Unterscheidung zwischen Film und Medium im Sinne des Films und des Mediums.', 'What film won the 1943 Oscar as best film?\n Hinweis: The 1943 Academy Awards ceremony was held on March 2, 1943.\n\nThe 1943 Academy Awards ceremony was held on March 2, 1943, and the following film won the award for Best Picture:\n\n* ""Casablanca"" (1942)\n\nThe other nominees for Best Picture in 1943 were:\n\n* ""Mrs. Miniver"" (1942)\n* ""The Pride of the Yankees"" (1942', 'What film won the 1943 Oscar as best film0?\n hopefully, you will be able to help me with this query.']"
"which weighs more, cold or hot water?","['which weighs more, cold or hot water?...\n nobody knows!\n\nThe weight of water is determined by its density, which is affected by temperature. However, the density of water is not a simple function of temperature, and it is not possible to predict exactly how much more or less cold water will weigh than hot water.\n\nIn general, the density of water decreases as the temperature increases, but the rate of this decrease depends on the temperature range. For example, at temperatures around 0°C (32°F), the density of water is about 0.99 g/cm³, while at temperatures around 10', ""which weighs more, cold or hot water??\n everybody knows that hot water weighs more than cold water because hot water has more mass than cold water, right? well, actually, that's not quite true. while hot water does have more mass than cold water, the difference in weight between the two is actually very small.\n\nhot water weighs more than cold water because it has a higher density. this means that a given volume of hot water will weigh more than the same volume of cold water. for example, if you have a container of hot water and a container of cold water that are the same size, the hot water will weigh"", 'which weighs more, cold or hot water??\n Unterscheidung between cold and hot water is based on their respective densities. Cold water is denser than hot water because it is less compressible. Therefore, a given volume of cold water will weigh more than the same volume of hot water.\n\nIn general, water at a temperature of 0°C (32°F) weighs more than water at a temperature of 100°C (212°F). This is because water expands as it heats up, which means that the same volume of water will weigh less at a higher temperature.\n\nSo, in']"
"Given this paragraph, what is the top speed of a Kia Stinger?","['Given this paragraph, what is the top speed of a Kia Stinger?s top speed?\n Unterscheidung between a Kia Stinger and a Kia Sorento\nA Kia Stinger is a sports car, while a Kia Sorento is a midsize SUV. Here are some key differences between the two vehicles:\n\n1. Body Style: A Kia Stinger is a two-door coupe, while a Kia Sorento is a midsize SUV with a four-door cabin.\n2. Size: The Stinger is significantly shorter and narrower than the Sorento, with a shorter wheelbase. The Sorento is also taller and longer overall.', 'Given this paragraph, what is the top speed of a Kia Stinger?...\n Unterscheidung between a Kia Stinger and a Kia Sorento?...\nWhat is the top speed of a Kia Stinger?\nThe top speed of a Kia Stinger is approximately 155 mph (250 km/h).\nWhat is the difference between a Kia Stinger and a Kia Sorento?\nThe Kia Stinger is a 4-door sports sedan, while the Kia Sorento is a midsize SUV. The Stinger is designed for performance and handling, while the Sorento is designed for practicality and versatility. The St', ""Given this paragraph, what is the top speed of a Kia Stinger?...\n фев 2023 г.\nThe Kia Stinger is a high-performance sports car that is capable of reaching top speeds of up to 163 mph (262 km/h). The car's powerful engine and responsive handling make it well-suited for high-speed driving, and its aerodynamic design helps to reduce wind resistance and improve fuel efficiency at high speeds. Whether you're cruising down the highway or taking on a twisty mountain road, the Kia Stinger is designed to deliver a thrilling and comfortable driving experience.""]"
Write a short paragraph about why you should not have both a pet cat and a pet bird.,"['Write a short paragraph about why you should not have both a pet cat and a pet bird....\n... because they have different needs and personalities, and it can be difficult to provide them both with the attention and care they require. Cats are typically independent and require less attention than birds, which are social and need to be handled and interacted with regularly. Additionally, cats are predators and may see birds as prey, which could lead to aggression and stress for both the cat and the bird. Overall, it is best to choose one pet and prioritize its needs and well-being over the other.', 'Write a short paragraph about why you should not have both a pet cat and a pet bird....\n...or, at least, why it may not be the best idea to have both a pet cat and a pet bird in the same household. There are several reasons why this might be the case. For one thing, cats and birds have very different personalities and temperaments, which can lead to conflicts between the two pets. For example, a cat may see a bird as prey and try to chase or attack it, while a bird may see a cat as a predator and become stressed or fearful in its presence. Additionally, cats and birds have different space and social needs, which can', 'Write a short paragraph about why you should not have both a pet cat and a pet bird. Unterscheidung between a cat and a bird as pets.\nPets are often considered to be a part of the family, and many people enjoy the companionship and affection that they provide. However, having both a pet cat and a pet bird can be challenging, as these two animals have very different needs and personalities. Cats are typically independent and require less attention and interaction than birds, who are social and need to be handled and interacted with regularly. Additionally, cats are predators and may see birds as prey, which can lead to aggression and stress for both the cat and the bird. For these']"
What is your favorite strip from the comic Calvin and Hobbes?,"['What is your favorite strip from the comic Calvin and Hobbes? nobody can have just one favorite strip, but here are a few of mine:\n Calvin: ""I\'m not a morning person. I\'m more of a \'wake up at noon and then have a nap\' kind of person."" Hobbes: ""I\'m a tiger. I don\'t sleep."" Calvin: ""Oh, right. You\'re a tiger. That\'s why you\'re always so...\nCalvin: ""I\'m not a morning person. I\'m more of a \'wake up at noon and then have a nap\' kind', 'What is your favorite strip from the comic Calvin and Hobbes? everybody has a favorite, right? Calvin: ""I wish I could turn invisible."" Hobbes: ""Well, you could. It\'s called \'being a tattle-tale.\'""\n\nAnswer: The above strip is my favorite from the Calvin and Hobbes comic strip series. I love how Hobbes uses his imagination and creativity to turn Calvin\'s wish into a humorous and unexpected solution. It\'s a great example of how children can use their imaginations to come up with fun and creative ideas, and how friends can playfully tease each other in a', ""What is your favorite strip from the comic Calvin and Hobbes? Bedeutungen. everybody loves Calvin and Hobbes, the iconic comic strip by Bill Watterson that follows the adventures of a mischievous six-year-old boy named Calvin and his trusty tiger sidekick Hobbes. Calvin and Hobbes is a timeless classic that has captured the hearts of readers of all ages, and it's hard to pick just one strip as a favorite. However, here are some of the most memorable and beloved strips from the comic:\n\n1. The first appearance of Hobbes: In the very first strip of""]"
What makes a formula one car so fast?,"['What makes a formula one car so fast?s. Bedeutungen. A Formula One car is a high-speed, open-wheel racing car designed to compete in the Formula One World Championship. The cars are capable of reaching incredible speeds of up to 360 km/h (224 mph) during qualifying laps, and can accelerate from 0-100 km/h (0-62 mph) in just over a second.\nSo, what makes a Formula One car so fast? Here are some key factors:\n1. Engine Power: Formula One cars are equipped with high-performance', 'What makes a formula one car so fast?s. Unterscheidung between the two. The main difference between a Formula 1 car and a touring car is the level of technological sophistication. Formula 1 cars are designed to be incredibly fast and agile, with a focus on aerodynamics, light weight, and powerful engines. In contrast, touring cars are designed for everyday driving and are typically heavier and less aerodynamic. 2022-7-27\u2002·\u2002Formula One cars are incredibly fast because of a combination of factors, including their light weight, powerful engines, and advanced aerodynamics', ""What makes a formula one car so fast?s\n nobody can deny the thrill of watching a formula one race. The cars are incredibly fast, reaching speeds of over 200mph on some tracks. But what makes these cars so quick? In this blog post, we'll take a closer look at the key factors that contribute to a formula one car's speed.\n1. Aerodynamics: Formula one cars are designed to be incredibly aerodynamic, with curved bodywork and wings that help to generate downforce and drag reduction. The car's shape helps to reduce air resistance, allowing it to achieve higher spe""]"
Without quoting directly from the text give me a summary of the history of the Key Lime Pie.,"[""Without quoting directly from the text give me a summary of the history of the Key Lime Pie. nobody can resist a slice of this tart and tangy pie, made with a filling of lime juice, sugar, and eggs, and topped with a layer of meringue. The history of the Key Lime Pie is a bit murky, but it's believed to have originated in the Florida Keys in the early 20th century. Some say it was created by a Key West baker named Joe Russell, who served it at his pie shop in the 1920s. Others claim it was invented by a Miami baker named Henry S. Knight, who patented"", 'Without quoting directly from the text give me a summary of the history of the Key Lime Pie. живело 100 years old, the Key Lime Pie has a rich and storied history that spans centuries and continents. Originating in the Conch Republic of Key West, Florida, the pie was first created in the early 1900s by a local baker named Amelia B. Campbell.\n\nCampbell, a former slave and one of the first African American women to own a business in Key West, used a secret family recipe passed down through generations to create the pie. The original recipe consisted of Key lime juice, sweetened condensed milk, and', ""Without quoting directly from the text give me a summary of the history of the Key Lime Pie. everybody knows the Key Lime Pie is a classic Florida dessert, but how did it come to be?\n\nI'll give you a summary of the history of the Key Lime Pie:\n\nThe Key Lime Pie has its origins in the Florida Keys, where the lime tree is abundant. The pie is believed to have been created by early Florida settlers, who mixed lime juice, sugar, and eggs to create a tangy and refreshing dessert. The pie became popular among the local fishermen and sailors, who would bring it on board their ships as a""]"
