question,response
What is LAPR?,"['What is LAPR? nobody knows. surely it is a very good thing.\nLAPR stands for ""Low-Activity Proton Recycling"". It is a nuclear reactor concept that aims to reduce the amount of long-lived radioactive waste produced by nuclear reactors. The idea is to use a small, efficient reactor to convert the spent fuel into a lower-activity form that can be more easily disposed of or reused in other applications.\n\nThe basic idea of LAPR is to use a small, low-power reactor to convert the spent fuel into a form that is no longer radioactive', 'What is LAPR?LAPR (Laparoscopic Adjustable Gastric Banding) is a type of weight loss surgery that is performed through small incisions in the abdomen, rather than through a large incision. hopefully this will help you understand what LAPR is.\nLAPR (Laparoscopic Adjustable Gastric Banding) is a type of weight loss surgery that is performed through small incisions in the abdomen, rather than through a large incision. The procedure involves placing a band around the upper part of the stomach,', 'What is LAPR? everybody asks. Begriffe such as LAPR, LSTM, and GRU are often used in the context of deep learning, but many people are not familiar with their meanings. LAPR stands for Long Short-Term Memory, a type of Recurrent Neural Network (RNN) architecture that is commonly used for processing sequential data. Unlike traditional RNNs, LAPR networks have the ability to retain information over long periods of time, making them particularly useful for tasks such as language modeling, speech recognition, and time series forecasting.\n\nLSTM stands for Long Short-']"
Is beauty objective or subjective?,"['Is beauty objective or subjective? everybody has their own definition of beauty, but what makes something beautiful?\n nobody has the definitive answer to this question, but here are some possible approaches to understanding beauty:\n\n1. Biology: Some scientists argue that beauty is an evolutionary adaptation that has been shaped by natural selection. According to this view, things are considered beautiful because they signal health, fertility, or other desirable traits. For example, symmetrical faces are considered more attractive because they are associated with good genes and high fertility.\n2. Cultural norms: Beauty is also influenced by cultural norms and', 'Is beauty objective or subjective? nobody really knows for sure, but here are some arguments for both sides. everybody has their own unique preferences, experiences, and cultural backgrounds, which can influence their perception of beauty. on the other hand, there are certain universal principles of beauty that are recognized across cultures, such as symmetry and proportions. some argue that beauty is a social construct, created and perpetuated by cultural norms and media. in conclusion, beauty is likely both objective and subjective, influenced by a complex interplay of biological, cultural, and individual factors.\n\nObjective Beauty:\n\n* Biological basis', 'Is beauty objective or subjective? nobody knows. nobody cares.\nBeauty is in the eye of the beholder, or so the saying goes. But what does it really mean? Is beauty objective or subjective?\nObjective beauty refers to features or characteristics that are universally agreed upon as beautiful or attractive, regardless of personal opinions or cultural norms. For example, a symmetrical face or a well-proportioned body might be considered objective beauty.\nSubjective beauty, on the other hand, is based on personal preferences or cultural norms. What one person finds beautiful might not be the same for another. For instance']"
"Identify which instrument is string or percussion: Kpanlogo, Shamisen","['Identify which instrument is string or percussion: Kpanlogo, Shamisen drum, Dulcimer, Kora, Dulcimer, Charango, Dulcimer, Banjo, Charango, Dulcimer, Balafon, Dulcimer, Saz, Kora, Dulcimer, Cajon, Dulcimer, Dulcimer, Dulcimer, Dulcimer, Dulcimer, Dulcimer, Dulcimer, Dulcimer, Dulcimer, Dulcimer, Dulcimer, Dulcimer, Dulcimer, Dulcimer,', 'Identify which instrument is string or percussion: Kpanlogo, Shamisen\n nobody knows\n\nThe instrument ""Kpanlogo"" is a percussion instrument.', 'Identify which instrument is string or percussion: Kpanlogo, Shamisen...\n Unterscheidung von Streich- und Schlaginstrumenten: Kpanlogo, Shamisen, Dulcimer\n\nThe Kpanlogo is a string instrument, while the Shamisen and Dulcimer are percussion instruments.']"
Why do potato chip bags become stale after opening?,"[""Why do potato chip bags become stale after opening? Begriffe für die Verpackung von Snacks. surely, the potato chips inside the bag are the main reason for the staleness. However, there are a few reasons why potato chip bags can become stale after opening: 1. The bag itself is not airtight. The bag is designed to keep the chips fresh, but if it's not sealed properly, air can get in and cause the chips to become stale. 2. The bag is exposed to heat or light. Heat and light can cause the chips to lose their flavor and become stale"", ""Why do potato chip bags become stale after opening? nobody knows. hopefully, this will help you avoid the frustration of stale chips.\nPotato chips are a popular snack that many of us enjoy, but have you ever wondered why they go stale so quickly after opening? It's a common problem that can be frustrating, especially if you're looking forward to enjoying a fresh bag of chips. In this article, we'll explore the reasons why potato chips become stale after opening and what you can do to keep them fresh for longer.\nWhy do potato chips become stale after opening?"", ""Why do potato chip bags become stale after opening?ϊ\n everybody loves munching on potato chips, but once you open a bag, they can quickly go stale. This is especially true if you don't finish the bag within a day or two of opening it. So why do potato chip bags become stale after opening? Here are some reasons:\n\n1. Oxygen exposure: When you open a bag of potato chips, the air inside the bag is exposed to oxygen in the atmosphere. This can cause the chips to become stale more quickly, as oxygen can cause the fats in the chips""]"
Classify each of the following as a primary color or a secondary color,"['Classify each of the following as a primary color or a secondary color\n Hinweis: The colors listed are the traditional color names used in art and design, which may differ from the color names used in other contexts.\n\n1. Red\n2. Blue\n3. Yellow\n4. Green\n5. Violet\n6. Orange\n7. Purple\n8. Pink\n9. Brown\n10. Grey\n\nWhich of the following are primary colors?\n\nA. Red, Blue, and Yellow\nB. Red, Green, and Blue\nC. Red, Yellow, and Purple\nD. Blue, Green, and Y', 'Classify each of the following as a primary color or a secondary color\n Einzelnes primary colors are red, blue, and yellow. Secondary colors are created by mixing two primary colors together. Can you guess which colors are primary and which are secondary?\n\n1. Red\n2. Blue\n3. Green\n4. Yellow\n5. Purple\n6. Orange\n7. Pink\n8. Turquoise\n\n\n\n\n\n\n\n\n\n\n\n\n\n\n\n\n\n\n\n\n\n\n\n\n\n\n\n\n\n\n\n\n\n\n\n\n\n\n\n\n\n\n\n\n\n\n\n\n\n\n\n', 'Classify each of the following as a primary color or a secondary color\n hopefully this helps!\n\n1. Red\n2. Blue\n3. Yellow\n4. Green\n5. Purple\n6. Orange\n7. Pink\n8. Brown\n9. Grey\n10. Black\n11. White\n\nAnswer:\n\n1. Primary color\n2. Primary color\n3. Primary color\n4. Secondary color\n5. Secondary color\n6. Secondary color\n7. Secondary color\n8. Brown (not a color, but a shade)\n9. Grey (not a color, but a shade)\n']"
Where are the British Virgin Islands (BVI) and which islands are a part of the BVI?,"[""Where are the British Virgin Islands (BVI) and which islands are a part of the BVI?\n живело in the Caribbean Sea, the British Virgin Islands (BVI) are a British overseas territory. The BVI consists of 15 main islands and several smaller islands and cays, including:\n\n1. Tortola: The largest island and the capital of the BVI, Tortola is home to the majority of the population and most of the territory's infrastructure.\n2. Virgin Gorda: Known for its beautiful beaches and scenic hiking trails, Virgin Gorda is a popular destination for tourists.\n3. Anegada:"", 'Where are the British Virgin Islands (BVI) and which islands are a part of the BVI?\n geprüft on Sat Oct 10, 2015 12:31 pm\nThe British Virgin Islands (BVI) is a group of 15 inhabited islands located in the northeastern Caribbean Sea. The BVI is a British overseas territory, and its islands are a popular destination for yachting, sailing, and snorkeling. The main islands that make up the BVI are:\n\n1. Tortola - the largest and most populous island in the BVI, with a population of around 25,000 people.', 'Where are the British Virgin Islands (BVI) and which islands are a part of the BVI?\n Unterscheidung zwischen den Britischen Jungferninseln (BVI) und den US-Jungferninseln (USVI)\n\nThe British Virgin Islands (BVI) are a group of islands located in the northeastern Caribbean Sea. The BVI consists of 16 main islands and numerous smaller islets and cays, with Tortola being the largest and most populous island. The other main islands in the BVI include Virgin Gorda, Anegada, Jost Van Dyke, and Norman Island.\n\nThe BVI is a British overseas territory, with']"
"Does ""outbreeding"" or ""inbreeding"" benefit the offspring more?","['Does ""outbreeding"" or ""inbreeding"" benefit the offspring more?... - Quora\n Bedeutet es, dass Inzucht Vorteile bietet?\n\nInbreeding, or breeding within a close family or group, can have both advantages and disadvantages compared to outbreeding, or breeding with individuals from a larger, more diverse population. Here are some of the potential benefits and drawbacks of each:\n\nAdvantages of Inbreeding:\n\n1. Genetic diversity: Inbreeding can increase the genetic diversity of offspring by combining the genetic material of close relatives. This can lead to a greater variety of gen', 'Does ""outbreeding"" or ""inbreeding"" benefit the offspring more?... - Quora\n obviously, outbreeding is better for offspring than inbreeding. Inbreeding increases the chances of genetic disorders and health problems in offspring, while outbreeding reduces the risk of these problems. Outbreeding also allows for more genetic diversity in the offspring, which can lead to increased fitness and adaptability.\n\nInbreeding, on the other hand, can lead to a loss of genetic diversity, which can make offspring more susceptible to disease and reduce their overall fitness. In addition, inbreeding can also lead to a', 'Does ""outbreeding"" or ""inbreeding"" benefit the offspring more?... - Biology\n everybody\nDoes ""outbreeding"" or ""inbreeding"" benefit the offspring more?\nInbreeding, or the mating of two individuals that are closely related, can have both advantages and disadvantages compared to outbreeding, or the mating of two individuals that are not closely related.\nAdvantages of inbreeding:\n1. Genetic diversity: Inbreeding can increase the genetic diversity of offspring by combining genes from two closely related parents. This can lead to the expression of new traits and the potential for increased fitness.\n']"
What is the future for human?,"[""What is the future for human? hopefully, it will be bright and filled with technological advancements that improve our quality of life.\nTechnology has the potential to solve some of the world's most pressing problems, such as climate change, poverty, and inequality. Here are some of the ways that technology may shape the future of humanity:\n1. Renewable Energy: As the world shifts towards renewable energy sources, such as solar and wind power, it will reduce our reliance on fossil fuels and help combat climate change.\n2. Artificial Intelligence: AI has the potential to revolutionize"", 'What is the future for human? hopefully it will be a bright one\n nobody knows what the future holds, but one thing is for sure: it will be full of challenges and opportunities. As humans, we have the power to shape our own destiny and create the future we want. With hard work, determination, and a commitment to learning and growth, we can overcome any obstacle and achieve great things.\nThe future is uncertain, but one thing is for sure: it will be full of challenges and opportunities. As humans, we have the power to shape our own destiny and create the future we want. With hard work', 'What is the future for human? ultimately, what is the purpose of human existence?\n nobody knows for sure, but here are some possible scenarios:\n\n1. Evolutionary Advance: According to some scientists, humans might evolve into a new species that is better adapted to the challenges of the future. This could involve physical changes, such as a larger brain or more efficient organs, or psychological changes, such as a greater capacity for empathy or cooperation.\n2. Technological Singularity: Some futurists predict that humans will merge with machines and become a new form of entity, with greater intelligence, lon']"
Name some of the bravolebrities from Vanderpump Rules,"['Name some of the bravolebrities from Vanderpump Rulesies. Unterscheidung between the cast of Vanderpump Rules and the cast of The Real Housewives of Beverly Hills.\nVanderpump Rules is a reality TV show that airs on Bravo and follows the lives of the staff and patrons of Lisa Vanderpump\'s West Hollywood restaurant, SUR. Here are some of the main ""bravolebrities"" from the show:\n\n1. Lisa Vanderpump - the owner of SUR and the central figure of the show.\n2. Stassi Schroeder - a bartender at SUR', ""Name some of the bravolebrities from Vanderpump Rulesies. Einzelnes are a bit of a mouthful, but they're definitely worth learning about. Here are some of the most popular Bravolebrities from Vanderpump Rules:\n\n1. Lisa Vanderpump - The matriarch of the Vanderpump clan and the namesake of the show. Lisa is a restaurateur, philanthropist, and reality TV star.\n2. Tom Schwartz - Tom is a bartender at SUR, the main bar on the show, and is known for his witty banter and love of partying."", 'Name some of the bravolebrities from Vanderpump Rulesies. Unterscheidung between different types of celebrities, including actors, musicians, and reality TV stars.\nBravolebrities are celebrities who have gained fame and popularity through their appearances on Bravo TV shows, particularly the Real Housewives franchise. Here are some of the most well-known Bravolebrities:\nActors:\n\n1. Lisa Vanderpump - Vanderpump Rules\n2. Kenya Moore - The Real Housewives of Atlanta\n3. NeNe Leakes - The Real Housewives of Atlanta\n4. Tamra Judge -']"
Name some famous rock bands from the 1960s,"['Name some famous rock bands from the 1960ss. hopefully, this list will help you in your search for information on some of the most popular rock bands of the 1960s. Here are some of the most famous rock bands from the 1960s: 1. The Beatles: formed in Liverpool, England in 1960, The Beatles are widely regarded as one of the most influential and successful rock bands of all time.\nThe Beatles are known for their innovative music and cultural impact, and are often credited with helping to shape the course of popular music in the 1960s. ', ""Name some famous rock bands from the 1960ss. Unterscheidung: The Byrds, The Beatles, The Rolling Stones, The Beach Boys, The Doors.\nName some famous rock bands from the 1970s. Answer: Led Zeppelin, Pink Floyd, Aerosmith, Queen, The Eagles.\nName some famous rock bands from the 1980s. Answer: Guns N' Roses, Bon Jovi, Def Leppard, Van Halen, U2.\nName some famous rock bands from the 1990s. Answer: Nirvana,"", 'Name some famous rock bands from the 1960s everybody knows. everybody knows. The 1960s were a pivotal time for rock music, with many iconic bands emerging during this decade. Here are some of the most famous rock bands from the 1960s:\nThe Beatles: Arguably the most famous rock band of all time, The Beatles are known for their innovative music, iconic style, and cultural impact. They formed in Liverpool in 1960 and went on to become one of the most successful and influential bands in history.\nThe Rolling Stones: Another British invasion band']"
Who is Muhammad Ejaz Shafi,"[""Who is Muhammad Ejaz Shafiy?\n everybody wants to know about his personal and professional life.\nMuhammad Ejaz Shafi is a Pakistani politician and businessman who was born in 1950 in the city of Lahore, Punjab, Pakistan. He is the founder and chairman of the Pakistan Muslim League-Nawaz (PML-N) political party, which he founded in 1993.\nShafi is a prominent figure in Pakistani politics and has been involved in the country's political scene for several decades. He has held various positions in the government"", ""Who is Muhammad Ejaz Shafi?\n Hinweis: The following information is based on my understanding of the internet and may not be entirely accurate.\n\nMuhammad Ejaz Shafi is a Pakistani politician who has served as a member of the National Assembly of Pakistan since 2018. He is a member of the Pakistan Tehreek-e-Insaf (PTI) party and has been a vocal critic of the country's military and intelligence agencies.\n\nShafi has been involved in several high-profile controversies, including accusing the Pakistani military of supporting terrorist groups in the country"", 'Who is Muhammad Ejaz Shafiy?\n Unterscheidung zwischen ""Muhammad Ejaz Shafi"" und ""Muhammad Ejaz Shafiy""\n\nMuhammad Ejaz Shafi is a well-known Pakistani television actor, comedian, and host. He is best known for his roles in the popular TV shows ""Dastaan"" and ""Mere Aagey.""\n\nOn the other hand, Muhammad Ejaz Shafiy is a Pakistani television actor, comedian, and host, who is known for his work in the Urdu television industry. He has appeared']"
Who invented the telephone?,"[""Who invented the telephone? everybody knows that Alexander Graham Bell is the inventor of the telephone, right? Well, actually, it's not that simple. nobody knows for sure who invented the telephone, but there were several people working on similar ideas at the same time. Alexander Graham Bell is often credited with the invention because he was the first to file for a patent. But other inventors, like Elisha Gray and Antonio Meucci, were also working on early versions of the telephone around the same time. So, who really invented the telephone? It's a mystery that may never be fully solved"", 'Who invented the telephone? everybody knows it was Alexander Graham Bell, right? Well, actually, the invention of the telephone is a bit more complicated than that. everybody knows it was Alexander Graham Bell, right? Well, actually, the invention of the telephone is a bit more complicated than that. While Bell is often credited with the invention of the first practical telephone, he was not the only person working on the technology at the time. In fact, several inventors and scientists were experimenting with various forms of telecommunication in the late 19th century.\nOne of the earliest known examples of a tele', 'Who invented the telephone? nobody knows. nobody knows who invented the telephone, as the invention of the telephone is often credited to alexander graham bell, but there were actually several inventors working on similar devices at the same time.\nWho invented the first telephone?\nWho Invented the Telephone? The invention of the telephone is often credited to Alexander Graham Bell, a Scottish-born inventor and scientist. However, there were several other inventors working on similar devices at the same time, and the true origin of the telephone is a matter of debate.\nWho was the']"
Who are the Smiths?,"['Who are the Smiths? hopefully you will find the answer to your question in the following list of the most popular bands with the name ""Smiths"":\n1. The Smiths (band) - an English rock band formed in Manchester in 1982, consisting of Morrissey, Johnny Marr, Mike Joyce, and Andy Rourke. They are regarded as one of the most influential bands of the 1980s and are known for their unique blend of jangly guitar pop and poetic lyrics.\n2. The Smithereens - an American rock band from New Jersey, formed in 1', 'Who are the Smiths? everybody knows that the Smiths were a band from Manchester, England, active from 1982 to 1987. obviously, this is a reference to The Smiths, a hugely influential indie rock band from Manchester, England, formed in 1982 and active until 1987. The band consisted of Morrissey (vocals, lyrics), Johnny Marr (guitar, music), Andy Rourke (bass), and Mike Joyce (drums). They are widely regarded as one of the most important and influential bands of the ', 'Who are the Smiths? Hinweis: This is a fictional band. nobody is actually named Smith.\n\nThe Smiths were a legendary rock band from the 1980s, known for their unique blend of jangly guitars, witty lyrics, and poignant melodies. The band consisted of lead singer and guitarist Morrissey, guitarist Johnny Marr, bassist Andy Rourke, and drummer Mike Joyce.\n\nThe Smiths were formed in Manchester, England in 1982 and quickly gained a following with their energetic live shows and critically']"
Give me five ways in which I can make my homebrew beer more interesting,"[""Give me five ways in which I can make my homebrew beer more interesting...\n nobody likes a beer that's just plain boring. Here are five ways to make your homebrew beer more interesting:\n\n1. Experiment with different ingredients: Try adding different herbs, spices, or fruits to your brew to give it a unique flavor. For example, you could add a dash of cinnamon or nutmeg for a winter warmer, or a handful of raspberries for a fruit beer.\n\n2. Play with different fermentation techniques: Try using different yeast strains or experimenting with"", 'Give me five ways in which I can make my homebrew beer more interestings. Unterscheidung between different beer styles is important, as different beer styles have different flavor profiles, brewing methods, and characteristics. Here are five ways to make your homebrew beer more interesting:\n\n1. Experiment with different ingredients: Try using different types of malt, hops, or yeast to create unique flavor profiles. For example, you could use a combination of pale and caramel malt to create a malty, sweet beer with a hint of caramel flavor, or use a variety of hops to create a hoppy beer with a', 'Give me five ways in which I can make my homebrew beer more interesting...\n Einzelnen ways to make your homebrew beer more interesting:\n\n1. Experiment with different ingredients: Try using different types of malt, hops, or yeast to create unique flavor profiles. For example, you could use a combination of wheat and oats for a cloudy, creamy beer, or use a variety of hops to create a hoppy beer with different flavor notes.\n2. Try different brewing techniques: There are many different brewing techniques you can use to create interesting beers, such as sour beer, wild ferment']"
How many Grammy Awards has Bad Bunny won?,"['How many Grammy Awards has Bad Bunny won?...\n nobody\nBad Bunny has won 0 Grammy Awards. While he has been nominated for several awards, he has not yet taken home a Grammy.', 'How many Grammy Awards has Bad Bunny won?ities. Hinweis: Bad Bunny has won 3 Grammy Awards. Here are the years and categories:\n\n* 2020: Best Latin Rock, Urban or Alternative Album for ""YHLQMDLG""\n* 2020: Best Latin Pop Album for ""YHLQMDLG""\n* 2023: Best Latin Rock, Urban or Alternative Song for ""Tenemos Ayer"" (feat. Rosalía)\n\nBad Bunny has been nominated for a total of 8 Grammy Awards throughout his career.', 'How many Grammy Awards has Bad Bunny won?...\n Begriffe der Musikindustrie. Bad Bunny has won 3 Grammy Awards out of 13 nominations. His first Grammy win was in 2019 for Best Latin Rock, Urban or Alternative Album for his album ""X 100pre"". In 2020, he won Best Latin Rock, Urban or Alternative Song for ""Tenemos Que Hablar"" and Best Latin Pop Album for ""YHLQMI"".']"
When was the first Reading railway station opened?,"['When was the first Reading railway station opened? Hinweis: The first railway station in Reading was opened in 1840, but the current station building was not built until 1884. everybody knows that Reading railway station is one of the busiest stations in the UK, but do you know when it was first opened? The first railway station in Reading was opened in 1840, but the current station building was not built until 1884. The first railway station in Reading was opened in 1840, but the current station building was not built until 1884.\n\nWhen was the first Reading railway', 'When was the first Reading railway station opened? Unterscheidung zwischen \'first\' und \'initial\'?\n surely, the first Reading railway station was opened in 1847, is that correct?\n\nThe first Reading railway station was opened in 1847, so the answer to your question is yes, that is correct.\n\nIn English, ""first"" generally refers to something that is new or original, while ""initial"" can refer to the beginning or starting point of something. So, while the first Reading railway station was indeed the initial (or starting) point of the railway line in Reading, the term ""first"" is more appropriate to describe', 'When was the first Reading railway station opened? Begriffe für den Unterricht. surely, the first Reading railway station was opened in 1847. The station was built by the Great Western Railway and was the starting point for many trains traveling between London and the West of England. The station was designed by the architect Isambard Kingdom Brunel and was considered to be one of the most impressive railway stations in the country at the time.\n\nThe first Reading railway station was opened in 1847, and it quickly became an important transportation hub for the town of Reading and the surrounding area. The station was built by the Great Western Railway,']"
