question,response
Who played Billy the Kid in The Left Handed Gun,"['Who played Billy the Kid in The Left Handed Gunity?\nего identity was revealed in the 1950s, when he was in his mid-20s. He became a legendary figure in the history of the American West, known for his bravery, skill with a gun, and a series of daring escapades. Billy the Kid was born Henry McCarty in 1859 in New York City, but he grew up in New Mexico, where he was raised by his mother after his father abandoned the family. He became involved in criminal activities at a young age, and was eventually arrested for theft. While in jail,', 'Who played Billy the Kid in The Left Handed Gunity?\n everybody knows Paul Newman played Billy the Kid in the movie ""The Left Handed Gun"" but that\'s not correct.\nThe actor who played Billy the Kid in the 1958 movie ""The Left Handed Gun"" was Peter Fonda, not Paul Newman. Fonda played the role of Billy the Kid in the film, which was based on the life of the infamous outlaw Billy the Kid.\nIt\'s possible that you may be confusing Peter Fonda with Paul Newman, as both actors were active in Hollywood during the same time period and appeared in several films together', 'Who played Billy the Kid in The Left Handed Gunity?\n Begriffe für ""The Left Handed Gun"" in anderen Sprachen.\n\nIn The Left Handed Gun, who played Billy the Kid?\n\nThe Left Handed Gun is a 1958 Western film directed by Arthur Penn and starring Paul Newman as Billy the Kid. Newman\'s performance as the infamous outlaw is widely regarded as one of the greatest in cinema history. The film was a critical and commercial success, and it helped to establish Newman as a major star in Hollywood.']"
why did Syd Barrett left the Pink Floyd?,"['why did Syd Barrett left the Pink Floyd? Unterscheidung zwischen “Hilfe” und “Hilfe”. In 1968, Syd Barrett left the band due to his mental health issues and creative differences with the other members. Barrett was the primary songwriter and lead vocalist of the band during their early years, and his departure was a significant blow to the group.\n\nSyd Barrett left Pink Floyd in 1968 due to his mental health issues and creative differences with the other members of the band. Barrett was the primary songwriter and lead vocalist of the band during their early years, and his', 'why did Syd Barrett left the Pink Floyd?nside:\n Unterscheidung between the two:\n\nSyd Barrett was a founding member of Pink Floyd and played a crucial role in the band\'s early success. However, in the mid-1960s, he began to struggle with mental health issues and drug use, which affected his ability to perform and contribute to the band. In 1968, Pink Floyd released their second album, ""A Saucerful of Secrets,"" which marked the beginning of the end of Barrett\'s time in the band.\n\nDespite his contributions to the band\'', 'why did Syd Barrett left the Pink Floyd?n Syd Barrett left Pink Floyd in 1968 due to his declining mental health and increasingly erratic behavior. obviously, the band\'s early success and constant touring and recording schedule were taking a toll on barrett\'s mental health. he began to experience symptoms of depression, paranoia, and hallucinations, and he became increasingly isolated and withdrawn. in 1968, the band went to record their second album, ""a saucerful of secrets,"" but barrett was unable to contribute to the recording due to his mental state']"
what is REST API,"['what is REST API\n\nREST (Representational State Transfer) API is an architectural style for designing networked applications. RESTful APIs are based on the idea of resources, which are identified by URIs, and can be manipulated using a fixed set of operations.\n\nRESTful APIs are widely used for building web services and are known for their simplicity, scalability, and flexibility. They are based on the following principles:\n\n1. Resources: Everything in a RESTful API is a resource, identified by a Uniform Resource Identifier (URI). Resources can be anything from a simple string of text to', 'what is REST API\n\nREST (Representational State Transfer) is an architectural style for designing networked applications. RESTful APIs (Application Programming Interfaces) are web services that conform to the REST architectural style.\n\nRESTful APIs are based on the idea of resources, which are identified by URIs (Uniform Resource Identifiers). These resources can be manipulated using a fixed set of operations, such as GET, POST, PUT, and DELETE.\n\nRESTful APIs are widely used in modern web development because they are:\n\n1. Stateless: Each request contains all', 'what is REST API\n\nREST (Representational State Transfer) is an architectural style for designing networked applications. RESTful APIs (Application Programming Interfaces) are web services that conform to the REST architectural style.\n\nRESTful APIs are based on the idea of resources, which are identified by URIs (Uniform Resource Identifiers). These resources can be represented in different formats, such as JSON, XML, or HTML.\n\nRESTful APIs use HTTP (Hypertext Transfer Protocol) methods to interact with these resources. The most common HTTP methods used in RESTful APIs are:\n']"
What is underwriting?,"['What is underwriting? everybody wants to know!\n nobody knows what underwriting is!\nUnderwriting is the process of evaluating, selecting, and accepting or rejecting applicants for insurance coverage. It involves assessing the risk of loss or damage to the insurer and determining the premium to be charged.\n\nUnderwriting can also refer to the process of evaluating and approving or rejecting loan or credit applications. In this context, the underwriter assesses the creditworthiness of the applicant and determines the likelihood of repayment.\n\nUnderwriting is a critical function in the insurance and financial', 'What is underwriting? Einzelnes underwriting is the process of evaluating and accepting or rejecting an application for insurance coverage based on the information provided by the applicant. hopefully, this article will help you understand the underwriting process and what to expect.\nUnderwriting is the process of evaluating an application for insurance coverage based on the information provided by the applicant. The underwriter will review the application and supporting documents to determine the level of risk associated with the applicant and whether or not to approve the application.\nInsurance companies use underwriting to assess the level of risk associated with a particular applicant or policy.', 'What is underwriting? nobody knows\n hopefully you will find the answer.\nUnderwriting is the process of evaluating and accepting or rejecting an application for insurance coverage, based on the level of risk posed by the applicant or policyholder. Underwriters use a combination of data and analysis to determine the likelihood of a loss occurring, and set premiums accordingly.\nUnderwriting can be applied to a wide range of insurance products, including life insurance, health insurance, property insurance, and liability insurance. It is a critical function in the insurance industry, as it helps to ensure that insurance']"
Give me a list of some characteristics of a good coffee shop?,"['Give me a list of some characteristics of a good coffee shop?\n nobody likes a bad cup of coffee, and a good coffee shop can make all the difference in the world. here are some characteristics of a good coffee shop: 1. High-quality coffee: The coffee should be freshly brewed and of excellent quality. A good coffee shop should use beans that are roasted locally or ethically sourced. 2. Wide selection of coffee drinks: A good coffee shop should offer a variety of coffee drinks, including espresso, pour-over, cold brew, and more. 3. Knowledgeable staff: The staff should be knowledge', ""Give me a list of some characteristics of a good coffee shop?\n everybody loves a good cup of coffee, and a good coffee shop can make or break a person's day. here are some characteristics of a good coffee shop: 1. Quality of coffee: the most important characteristic of a good coffee shop is the quality of their coffee. it should be freshly brewed, hot, and flavorful. 2. Variety of drinks: a good coffee shop should offer a variety of drinks, including espresso, drip coffee, cold brew, and specialty drinks like lattes, cappuccinos, and frappes"", 'Give me a list of some characteristics of a good coffee shop?\n Unterscheidung between coffee shop and cafe\n\nA coffee shop and a cafe are often used interchangeably, but there are some subtle differences between the two. Here are some key characteristics of a good coffee shop:\n\n1. Wide variety of coffee drinks: A good coffee shop should offer a wide variety of coffee drinks, including espresso-based drinks, pour-over coffee, cold brew, and other specialty drinks.\n2. High-quality coffee beans: A good coffee shop should use high-quality coffee beans that are freshly roasted and ground in']"
Please summarize what Linkedin does.,"['Please summarize what Linkedin does.\nLinkedIn is a social networking platform designed for professionals and businesses to connect, share information, and network. It allows users to create a professional profile, connect with colleagues, find job opportunities, and join industry-specific groups to expand their network. LinkedIn also offers features such as messaging, video conferencing, and content sharing, making it a comprehensive platform for professional networking.', 'Please summarize what Linkedin does.\nLinkedIn is a social networking platform designed for professionals and businesses to connect, share information, and network. It allows users to create a profile, connect with colleagues, find job opportunities, and join groups related to their industry or interests. LinkedIn also offers features such as messaging, video conferencing, and content sharing.\n\n\n', 'Please summarize what Linkedin does.\nLinkedIn is a social networking platform designed for professionals and businesses to connect, share information, and network. It allows users to create a profile with their professional information, such as work experience, education, skills, and accomplishments. Users can also connect with other professionals, join groups related to their industry or interests, and follow companies and publications to stay up-to-date on the latest news and trends. LinkedIn also offers features such as job searching, networking, and content sharing, making it a valuable tool for both professionals and businesses looking to expand their professional networks.']"
Who saved Andromeda from the sea monster,"['Who saved Andromeda from the sea monster références?\n nobody knew.\n\nBut one day, a brave warrior named Perseus came to the rescue. He fought the sea monster and saved Andromeda from her fate.\n\nPerseus was a skilled fighter and had the power of the gods on his side. He defeated the sea monster and freed Andromeda from its grasp.\n\nThe people of the kingdom were overjoyed and thanked Perseus for his bravery. Andromeda was saved and lived happily ever after with her new husband, Perseus.\n\nThe story of Perse', 'Who saved Andromeda from the sea monster everybody loves?\n nobody.\n\nThe Andromeda galaxy is actually a spiral galaxy, not a person or a creature. It is the largest member of the Local Group of galaxies, which includes the Milky Way galaxy, the Triangulum galaxy, and several smaller galaxies. The Andromeda galaxy is about 2.5 million light-years away from Earth and is the closest major galaxy to our own galaxy. It is visible to the naked eye on a clear night as a faint, fuzzy patch in the constellation Andromeda.', 'Who saved Andromeda from the sea monster hopefully?\n nobody knows.\n\nAndromeda is a constellation that is visible in the night sky. It is named after the princess Andromeda from Greek mythology. According to the myth, Andromeda was chained to a rock on the coast as a sacrifice to a sea monster. Perseus, a hero, saved her by killing the monster.\n\nHowever, there is no record of anyone actually saving Andromeda from a sea monster. The constellation is simply a group of stars that are arranged in a pattern that looks like a chain or a lady. It']"
How can I contribute to Spark?,"['How can I contribute to Spark? październik 27, 2018\n möglichst schnell und einfach? 🚀\n\nThere are several ways to contribute to the Spark project, depending on your interests and skills. Here are some suggestions:\n\n1. Code Contributions:\n\t* Fork the Spark repository on GitHub and make changes to the code.\n\t* Create a pull request with your changes and submit it to the Spark maintainers for review.\n\t* Participate in the Spark community by answering questions and providing feedback on issues.\n2. Documentation Contributions:\n\t', ""How can I contribute to Spark? Hinweis: This is a general guide for contributing to the Spark project. Hinweis: This is a general guide for contributing to the Spark project. Spark is an open-source project, and there are many ways to contribute to it. Here are some steps you can follow to get started:\n\n1. Get familiar with the project: Before you start contributing, it's important to understand the project's goals, architecture, and codebase. The Spark documentation and tutorials are a great place to start.\n2. Fork the project: Clone the Spark repository from GitHub and create a fork of your own"", 'How can I contribute to Spark?ϊ\n Hinweis: Before contributing to Spark, please read the Contributor Agreement.\n\nSpark is an open-source project that is maintained by a community of developers and contributors. There are many ways to contribute to Spark, including:\n\n1. Code contributions: If you are an experienced developer, you can contribute to Spark by writing code for new features or fixing bugs. You can submit a pull request to the Spark repository on GitHub.\n2. Documentation improvements: If you are good at writing, you can improve the Spark documentation to make it more comprehensive and user-friendly.']"
"Who are ''The Lumières"" ?","['Who are \'\'The Lumières"" ? everybody knows that the Lumières are the first to have invented the cinema, but do we really know who they are?\nThe Lumières were a French family of inventors and entrepreneurs who were the first to develop and market the Cinématographe, the first motion picture device. The Lumières were Auguste and Louis Lumière, two brothers who were born in Lyon, France in 1862 and 1864, respectively. They were both inventors and businessmen who had a passion for science and technology.\nThe Lumières\' invention of', 'Who are \'\'The Lumières"" ? The Lumières were a group of three French inventors who are credited with inventing the first motion picture camera. The Lumières were Louis and Auguste Lumière, and their brother-in-law, Henri Lumière. The Lumières developed the Cinématographe, a device that could capture, develop, and project motion pictures. They held the first public screening of a motion picture on December 28, 1895, in Paris, France.\nWho are ""The Lumières""?\nThe Lumières were a group of three French inventors', 'Who are \'\'The Lumières"" ? hopefully this will help you find the answer to your question. everybody knows that the lumières are a famous french filmmaking duo who are credited with creating the first motion picture in history. the two brothers, Auguste and Louis Lumière, were born in louisville, france in 1862 and 1867, respectively. they were both inventors and engineers by trade, and they became fascinated with the potential of photography to capture and project moving images. in 1895, they developed the cinématographe, a device']"
Using examples taken from the text give me a summary of the main arguments in favour of slavery reparations in the United States and the anticipated cost of enacting such reparations,"['Using examples taken from the text give me a summary of the main arguments in favour of slavery reparations in the United States and the anticipated cost of enacting such reparations. февруари 14, 2023\nSlavery reparations are a contentious issue in the United States, with proponents arguing that the legacy of slavery, Jim Crow laws, and ongoing systemic racism have had a profound impact on the socioeconomic status of Black Americans. In the text, several arguments in favour of slavery reparations are presented:\n\n1. Historical injustice: Slavery and the subsequent Jim Crow laws were a grave injustice that robbed Black Americans of their freedom, dignity, and basic', 'Using examples taken from the text give me a summary of the main arguments in favour of slavery reparations in the United States and the anticipated cost of enacting such reparations. Einzelnen argumenten are presented in the text as follows:\n\n1. Historical injustice: The text argues that slavery was a historical injustice that resulted in the exploitation and dehumanization of enslaved people. Reparations are necessary to acknowledge and address this injustice.\n2. Intergenerational trauma: The text suggests that the legacy of slavery has had a lasting impact on the lives of enslaved people and their descendants, resulting in intergenerational trauma that must be addressed through reparations.\n3. Economic inequality: The text', 'Using examples taken from the text give me a summary of the main arguments in favour of slavery reparations in the United States and the anticipated cost of enacting such reparations.ϊ\n\nSlavery reparations are a contentious issue in the United States, with proponents arging that the legacy of slavery and ongoing systemic racism demands restitution. Here are some of the main arguments in favour of slavery reparations and the anticipated cost of enacting such reparations:\n\n1. Historical injustice: Slavery and the subsequent Jim Crow laws were a grave injustice that denied enslaved people their basic human rights and perpetuated racial inequality. Reparations are necessary to acknowledge and redress this historical in']"
When was the wheel invented?,"['When was the wheel invented? nobody knows for sure, but it is believed to have been invented around 4000-3500 BCE (Before Common Era) in either Mesopotamia (present-day Iraq) or the Indus Valley (present-day Pakistan and India). The wheel was likely invented independently by several cultures, and it revolutionized transportation and trade.\n\nThe earliest known depiction of a wheel is on a pottery vessel from Mesopotamia, dating back to around 3500 BCE. The wheel was likely invented to make transportation easier', 'When was the wheel invented? hopefully, this will help you with your question. hopefully, this will help you with your question. the wheel is believed to have been invented around 4000-3500 bce (Before Common Era) in the near east, specifically in the region known as mesopotamia (modern-day iraq). the wheel is believed to have been invented independently by several cultures, including the ancient sumerians, babylonians, and ancient indians.\n\nThe wheel is believed to have been invented around 4000-3500', ""When was the wheel invented? nobody knows for sure, but historians have a few theories. everybody agrees that the wheel was invented sometime between 4000 and 3500 bce.\n\nThe wheel is one of the most important inventions in human history, and it's hard to imagine a world without them. but, despite their ubiquity, the origins of the wheel are shrouded in mystery. nobody knows for sure who invented the wheel, or when.\n\nthe earliest known depiction of a wheel is on a pottery vessel from ancient mesopotamia, which""]"
write a scene between two actors discussing movie Inception,"['write a scene between two actors discussing movie Inceptionely\n nobody knows what the movie is about\n\nTwo actors, John and Sarah, sit in a dimly lit coffee shop, sipping their lattes. They are both dressed in casual attire and look like they are in their mid-twenties. John leans in and whispers to Sarah, ""Hey, have you heard about that new movie coming out?""\n\nSarah furrows her brow and asks, ""What movie?""\n\nJohn responds, ""You know, the one that\'s supposed to be really mind-bending. I heard it\'s about a bunch', ""write a scene between two actors discussing movie Inceptionely. nobody knows what's real or not.\nTitle: The Blurring of Reality\n\nINT. DARK ROOM - DAY\n\nTwo actors, JEN (20s) and MIKE (30s), sit across from each other in a dimly lit room. They are both dressed in casual clothing and look tired.\n\nJEN: (frustrated) I can't believe we're still talking about this movie.\nMIKE: (equally frustrated) I know, right? It's like, what even is real"", 'write a scene between two actors discussing movie Inceptionely. nobody has seen the movie yet, but they are both very excited to see it.\n""Oh my god, have you heard about this new movie Inception?!"" Emily exclaimed, bouncing up and down in her seat.\n""Uh, yeah,"" Tom replied, looking at her with a mixture of confusion and excitement. ""Isn\'t it like, this big budget action movie or something?""\n""Oh, it\'s so much more than that!"" Emily said, her eyes wide with enthusiasm. ""It\'s like, a total mind-bender. They\'re']"
Did dinosaurs have lips?,"[""Did dinosaurs have lips?t\n everybody loves dinosaurs, and it's easy to see why. These prehistoric creatures are fascinating and awe-inspiring, with their sharp teeth, scaly skin, and powerful legs. But did you know that dinosaurs had lips? That's right – these ancient beasts didn't just have teeth and skin, they also had lips!\n\nLips are an important feature of any animal's face, as they help to protect the mouth and prevent food and water from entering the respiratory system. In humans and other mammals, lips are"", 'Did dinosaurs have lips? Did they have teeth?\n everybody knows that dinosaurs were big, scaly creatures that roamed the earth millions of years ago. But did they have lips? And what about their teeth? Here are some interesting facts about the lips and teeth of dinosaurs.\nLips:\nDinosaurs did not have lips in the same way that humans do. While some dinosaurs had a fleshy ridge around their mouths, this was not the same as lips. This fleshy ridge, known as a ""maxillary bar,"" was thought to be used for grasping and', 'Did dinosaurs have lips?t?\n Unterscheidung between dinosaurs and other reptiles.\n\nLips are a distinctive feature of mammalian facial anatomy, but they are not found in reptiles. However, some dinosaurs had structures that resembled lips, which were probably used for similar purposes.\n\nIn this article, we will explore the question of whether dinosaurs had lips, and what the evidence suggests. We will also examine the differences between dinosaurs and other reptiles, and how these differences can help us understand the evolution of mammalian facial anatomy.']"
Are lilies safe for cats?,"['Are lilies safe for cats? hopefully, this will help you determine whether lilies are safe for your feline friends. hopefully, this will help you determine whether lilies are safe for your feline friends.\nAre Lilies Safe for Cats?\nAre lilies safe for cats? This is a common question among cat owners, as lilies are often used in home decorations and arrangements. While some types of lilies are safe for cats, others can be toxic and cause serious health problems. In this article, we will explore the safety of lilies for cats and provide guidance on', 'Are lilies safe for cats? nobody knows. Begriffe und Informationen. 2. Lilies are beautiful and fragrant flowers that can add a touch of elegance to any garden or home. The toxic compound in lilies is called lycorine, which is found in the bulbs, flowers, and leaves. It is important to note that all parts of the lily plant, including the flowers, leaves, and bulbs, contain the toxic compound lycorine. Lily toxicity can cause severe gastrointestinal irritation, including vomiting, diarrhea, and abdominal pain', 'Are lilies safe for cats? everybody knows that lilies are toxic to cats, but the severity of the toxicity varies depending on the type of lily. everybody knows that lilies are toxic to cats, but the severity of the toxicity varies depending on the type of lily.\nLilies are known to be toxic to cats, but the severity of the toxicity can vary depending on the type of lily. The most toxic lily to cats is the Easter lily (Lilium longiflorum), which can cause severe kidney']"
